[
  {
    "protocol": "hailiang.sse.v3",
    "event_id": "3d1c3fce2a2920bb723f06ca3dd3ee2f00076b21d621a20b63fdd8591479d396:1",
    "seq": 1,
    "session_id": "demo-session",
    "profile_id": "demo-profile",
    "run_id": "run_779e502abd924727b741d331125799f2",
    "type": "run.updated",
    "entity_id": "run_779e502abd924727b741d331125799f2",
    "entity_version": 1,
    "timestamp": "2026-10-19T06:25:04.722634+00:00",
    "data": {
      "run_id": "run_779e502abd924727b741d331125799f2",
      "session_id": "demo-session",
      "profile_id": "demo-profile",
      "goal": "为孩子规划",
      "status": "running",
      "root_task_id": "task_d87ad56714c340f7a4fe3b2d1cef061e",
      "created_at": "2026-10-19T06:25:04.718385+00:00",
      "updated_at": "2026-10-19T06:25:04.719781+00:00",
      "phase": "",
      "result": "",
      "error": null,
      "input_tokens_estimated": 0,
      "input_tokens_actual": null,
      "input_token_limit": 300000,
      "completed_count": 0,
      "task_count": 0,
      "waiting_count": 0,
      "id": "run_779e502abd924727b741d331125799f2",
      "elapsed_ms": 1,
      "allowed_actions": [
        "start",
        "cancel",
        "answer"
      ],
      "outcome": null,
      "version": 1
    }
  },
  {
    "protocol": "hailiang.sse.v3",
    "event_id": "3d1c3fce2a2920bb723f06ca3dd3ee2f00076b21d621a20b63fdd8591479d396:2",
    "seq": 2,
    "session_id": "demo-session",
    "profile_id": "demo-profile",
    "run_id": "run_779e502abd924727b741d331125799f2",
    "type": "node.updated",
    "entity_id": "task_d87ad56714c340f7a4fe3b2d1cef061e",
    "entity_version": 1,
    "timestamp": "2026-10-19T06:25:04.722706+00:00",
    "data": {
      "id": "task_d87ad56714c340f7a4fe3b2d1cef061e",
      "parent_id": null,
      "kind": "main",
      "title": "为孩子规划",
      "actor": "主 agent",
      "status": "queued",
      "created_at": "2026-10-19T06:25:04.718368+00:00",
      "started_at": null,
      "ended_at": null,
      "error": null,
      "stale": false,
      "run_id": "run_779e502abd924727b741d331125799f2",
      "outcome": null,
      "version": 1
    }
  },
  {
    "protocol": "hailiang.sse.v3",
    "event_id": "3d1c3fce2a2920bb723f06ca3dd3ee2f00076b21d621a20b63fdd8591479d396:3",
    "seq": 3,
    "session_id": "demo-session",
    "profile_id": "demo-profile",
    "run_id": "run_779e502abd924727b741d331125799f2",
    "type": "run.updated",
    "entity_id": "run_779e502abd924727b741d331125799f2",
    "entity_version": 2,
    "timestamp": "2026-10-19T06:25:04.728452+00:00",
    "data": {
      "run_id": "run_779e502abd924727b741d331125799f2",
      "session_id": "demo-session",
      "profile_id": "demo-profile",
      "goal": "为孩子规划",
      "status": "running",
      "root_task_id": "task_d87ad56714c340f7a4fe3b2d1cef061e",
      "created_at": "2026-10-19T06:25:04.718385+00:00",
      "updated_at": "2026-10-19T06:25:04.725642+00:00",
      "phase": "",
      "result": "",
      "error": null,
      "input_tokens_estimated": 0,
      "input_tokens_actual": null,
      "input_token_limit": 300000,
      "completed_count": 0,
      "task_count": 0,
      "waiting_count": 0,
      "id": "run_779e502abd924727b741d331125799f2",
      "elapsed_ms": 7,
      "allowed_actions": [
        "start",
        "cancel",
        "answer"
      ],
      "outcome": null,
      "version": 2
    }
  },
  {
    "protocol": "hailiang.sse.v3",
    "event_id": "3d1c3fce2a2920bb723f06ca3dd3ee2f00076b21d621a20b63fdd8591479d396:4",
    "seq": 4,
    "session_id": "demo-session",
    "profile_id": "demo-profile",
    "run_id": "run_779e502abd924727b741d331125799f2",
    "type": "node.updated",
    "entity_id": "task_d87ad56714c340f7a4fe3b2d1cef061e",
    "entity_version": 2,
    "timestamp": "2026-10-19T06:25:04.728525+00:00",
    "data": {
      "id": "task_d87ad56714c340f7a4fe3b2d1cef061e",
      "parent_id": null,
      "kind": "main",
      "title": "为孩子规划",
      "actor": "主 agent",
      "status": "running",
      "created_at": "2026-10-19T06:25:04.718368+00:00",
      "started_at": "2026-10-19T06:25:04.725632+00:00",
      "ended_at": null,
      "error": null,
      "stale": false,
      "run_id": "run_779e502abd924727b741d331125799f2",
      "outcome": null,
      "version": 2
    }
  },
  {
    "protocol": "hailiang.sse.v3",
    "event_id": "3d1c3fce2a2920bb723f06ca3dd3ee2f00076b21d621a20b63fdd8591479d396:5",
    "seq": 5,
    "session_id": "demo-session",
    "profile_id": "demo-profile",
    "run_id": "run_779e502abd924727b741d331125799f2",
    "type": "run.updated",
    "entity_id": "run_779e502abd924727b741d331125799f2",
    "entity_version": 3,
    "timestamp": "2026-10-19T06:25:04.735251+00:00",
    "data": {
      "run_id": "run_779e502abd924727b741d331125799f2",
      "session_id": "demo-session",
      "profile_id": "demo-profile",
      "goal": "为孩子规划",
      "status": "running",
      "root_task_id": "task_d87ad56714c340f7a4fe3b2d1cef061e",
      "created_at": "2026-10-19T06:25:04.718385+00:00",
      "updated_at": "2026-10-19T06:25:04.732662+00:00",
      "phase": "",
      "result": "",
      "error": null,
      "input_tokens_estimated": 5040,
      "input_tokens_actual": null,
      "input_token_limit": 300000,
      "completed_count": 0,
      "task_count": 0,
      "waiting_count": 0,
      "id": "run_779e502abd924727b741d331125799f2",
      "elapsed_ms": 14,
      "allowed_actions": [
        "start",
        "cancel",
        "answer"
      ],
      "outcome": null,
      "version": 3
    }
  },
  {
    "protocol": "hailiang.sse.v3",
    "event_id": "3d1c3fce2a2920bb723f06ca3dd3ee2f00076b21d621a20b63fdd8591479d396:6",
    "seq": 6,
    "session_id": "demo-session",
    "profile_id": "demo-profile",
    "run_id": "run_779e502abd924727b741d331125799f2",
    "type": "run.updated",
    "entity_id": "run_779e502abd924727b741d331125799f2",
    "entity_version": 4,
    "timestamp": "2026-10-19T06:25:04.740210+00:00",
    "data": {
      "run_id": "run_779e502abd924727b741d331125799f2",
      "session_id": "demo-session",
      "profile_id": "demo-profile",
      "goal": "为孩子规划",
      "status": "running",
      "root_task_id": "task_d87ad56714c340f7a4fe3b2d1cef061e",
      "created_at": "2026-10-19T06:25:04.718385+00:00",
      "updated_at": "2026-10-19T06:25:04.737081+00:00",
      "phase": "",
      "result": "",
      "error": null,
      "input_tokens_estimated": 5040,
      "input_tokens_actual": null,
      "input_token_limit": 300000,
      "completed_count": 0,
      "task_count": 0,
      "waiting_count": 0,
      "id": "run_779e502abd924727b741d331125799f2",
      "elapsed_ms": 18,
      "allowed_actions": [
        "start",
        "cancel",
        "answer"
      ],
      "outcome": null,
      "version": 4
    }
  },
  {
    "protocol": "hailiang.sse.v3",
    "event_id": "3d1c3fce2a2920bb723f06ca3dd3ee2f00076b21d621a20b63fdd8591479d396:7",
    "seq": 7,
    "session_id": "demo-session",
    "profile_id": "demo-profile",
    "run_id": "run_779e502abd924727b741d331125799f2",
    "type": "node.updated",
    "entity_id": "task_d87ad56714c340f7a4fe3b2d1cef061e",
    "entity_version": 3,
    "timestamp": "2026-10-19T06:25:04.740275+00:00",
    "data": {
      "id": "task_d87ad56714c340f7a4fe3b2d1cef061e",
      "parent_id": null,
      "kind": "main",
      "title": "为孩子规划",
      "actor": "主 agent",
      "status": "queued",
      "created_at": "2026-10-19T06:25:04.718368+00:00",
      "started_at": "2026-10-19T06:25:04.725632+00:00",
      "ended_at": null,
      "error": null,
      "stale": false,
      "run_id": "run_779e502abd924727b741d331125799f2",
      "outcome": null,
      "version": 3
    }
  },
  {
    "protocol": "hailiang.sse.v3",
    "event_id": "3d1c3fce2a2920bb723f06ca3dd3ee2f00076b21d621a20b63fdd8591479d396:8",
    "seq": 8,
    "session_id": "demo-session",
    "profile_id": "demo-profile",
    "run_id": "run_779e502abd924727b741d331125799f2",
    "type": "node.updated",
    "entity_id": "tool_c8e02b882d414e96a80ff17361234166",
    "entity_version": 1,
    "timestamp": "2026-10-19T06:25:04.740324+00:00",
    "data": {
      "id": "tool_c8e02b882d414e96a80ff17361234166",
      "parent_id": "task_d87ad56714c340f7a4fe3b2d1cef061e",
      "kind": "tool",
      "title": "分派专家任务",
      "status": "queued",
      "created_at": "2026-10-19T06:25:04.737070+00:00",
      "started_at": null,
      "ended_at": null,
      "attempts": 0,
      "error": null,
      "run_id": "run_779e502abd924727b741d331125799f2",
      "outcome": null,
      "version": 1
    }
  },
  {
    "protocol": "hailiang.sse.v3",
    "event_id": "3d1c3fce2a2920bb723f06ca3dd3ee2f00076b21d621a20b63fdd8591479d396:9",
    "seq": 9,
    "session_id": "demo-session",
    "profile_id": "demo-profile",
    "run_id": "run_779e502abd924727b741d331125799f2",
    "type": "run.updated",
    "entity_id": "run_779e502abd924727b741d331125799f2",
    "entity_version": 5,
    "timestamp": "2026-10-19T06:25:04.744294+00:00",
    "data": {
      "run_id": "run_779e502abd924727b741d331125799f2",
      "session_id": "demo-session",
      "profile_id": "demo-profile",
      "goal": "为孩子规划",
      "status": "running",
      "root_task_id": "task_d87ad56714c340f7a4fe3b2d1cef061e",
      "created_at": "2026-10-19T06:25:04.718385+00:00",
      "updated_at": "2026-10-19T06:25:04.741956+00:00",
      "phase": "",
      "result": "",
      "error": null,
      "input_tokens_estimated": 5040,
      "input_tokens_actual": null,
      "input_token_limit": 300000,
      "completed_count": 0,
      "task_count": 0,
      "waiting_count": 0,
      "id": "run_779e502abd924727b741d331125799f2",
      "elapsed_ms": 23,
      "allowed_actions": [
        "start",
        "cancel",
        "answer"
      ],
      "outcome": null,
      "version": 5
    }
  },
  {
    "protocol": "hailiang.sse.v3",
    "event_id": "3d1c3fce2a2920bb723f06ca3dd3ee2f00076b21d621a20b63fdd8591479d396:10",
    "seq": 10,
    "session_id": "demo-session",